{
  "$schema": "https://json-schema.org/draft/2020-12/schema",
  "$id": "xdebug.signal.changes.response.v1",
  "title": "signal.changes response",
  "type": "object",
  "required": [
    "api_version",
    "ok",
    "action",
    "summary",
    "data"
  ],
  "properties": {
    "api_version": {
      "type": "string",
      "enum": [
        "xdebug.v1"
      ]
    },
    "request_id": {
      "type": "string"
    },
    "ok": {
      "type": "boolean"
    },
    "action": {
      "type": "string",
      "enum": [
        "signal.changes"
      ]
    },
    "summary": {
      "type": "object",
      "additionalProperties": true
    },
    "data": {
      "type": "object"
    },
    "findings": {
      "type": "array"
    },
    "warnings": {
      "type": "array"
    },
    "error": {},
    "meta": {
      "type": "object"
    }
  },
  "additionalProperties": true,
  "description": "signal.changes response: 读取信号变化点。",
  "x-output_notes": "返回该 action 的 summary/data/error/meta；具体字段以 response schema 和 response example 为准。"
}
