{
  "api_version": "xdebug.v1",
  "ok": true,
  "action": "signal.changes",
  "summary": {
    "transition_count": 2,
    "returned_change_rows": 3,
    "includes_initial_value": true,
    "actual_transition_count": 2,
    "first_change": {
      "time": "100ns",
      "value": "0"
    },
    "last_change": {
      "time": "180ns",
      "value": "0"
    },
    "semantic_note": "signal.changes rows are value-change timeline rows; use signal.statistics for sampled high cycles."
  },
  "data": {
    "signal": "top.u.ready",
    "time_range": {
      "start": "100ns",
      "end": "200ns"
    },
    "final_value": "0"
  }
}
